{
  "$schema": "https://json-schema.org/draft/2020-12/schema",
  "$id": "https://yokai-fighters.local/schema/profile.schema.json",
  "title": "Behaviour profile",
  "description": "One yokai temperament read by the deterministic AI state machine (Y1, Y2) in data/profiles/<id>.json. Every 'when' is on-screen state, never a button press (P6).",
  "type": "object",
  "required": ["kind", "id", "yokai", "temperament", "reaction", "aggression_bias", "preferred_range", "habit", "behaviours", "rules"],
  "additionalProperties": false,
  "properties": {
    "kind": { "const": "profile" },
    "id": { "$ref": "common.schema.json#/$defs/id" },
    "status": { "$ref": "common.schema.json#/$defs/status" },
    "yokai": { "enum": ["kitsune", "oni", "kappa", "tanuki", "apprentice"], "description": "Whose profile it is. 'apprentice' (designer 2026-10-21): the row-1 apprentice's own profile; the node names it with 'profile' and plays as the Kitsune for body and kit, so it is never one of the Kitsune's temperaments." },
    "temperament": { "enum": ["aggressive", "patient", "boss"], "description": "'boss' only for the Tanuki." },
    "reaction": {
      "description": "Reaction-time tier and its frames (Y4). Y5 shaves 1 frame per Tanuki win at runtime; not stored here.",
      "enum": [
        { "tier": "apprentice", "frames": 30 },
        { "tier": "yokai", "frames": 22 },
        { "tier": "elder", "frames": 18 },
        { "tier": "tanuki", "frames": 15 }
      ]
    },
    "aggression_bias": {
      "type": "integer",
      "minimum": 0,
      "maximum": 100,
      "description": "0 = fully patient, 100 = fully aggressive; Y5 pushes it up per Tanuki win."
    },
    "preferred_range": { "enum": ["close", "mid", "full_screen"] },
    "habit": {
      "description": "Exactly one learnable, punishable habit (Y2, P6).",
      "type": "object",
      "required": ["id", "description", "when", "do", "chance_pct"],
      "additionalProperties": false,
      "properties": {
        "id": { "$ref": "common.schema.json#/$defs/id" },
        "description": { "type": "string", "minLength": 1 },
        "when": { "$ref": "#/$defs/observation" },
        "do": { "$ref": "#/$defs/action" },
        "chance_pct": { "type": "integer", "minimum": 1, "maximum": 100 }
      }
    },
    "behaviours": {
      "type": "array",
      "minItems": 1,
      "items": {
        "type": "object",
        "required": ["when", "do", "weight"],
        "additionalProperties": false,
        "properties": {
          "when": { "$ref": "#/$defs/observation" },
          "do": { "$ref": "#/$defs/action" },
          "weight": { "type": "integer", "minimum": 1, "maximum": 100 }
        }
      }
    },
    "tell_cover_pct": {
      "type": "integer",
      "minimum": 0,
      "maximum": 100,
      "description": "Difficulty knob (YOK-27): chance a habit that rolled true is held back anyway, so harder opponents show their tell less. Default 0."
    },
    "ex_use": {
      "description": "YOK-57 (E16, C5): when the AI picks a special and its own meter on screen covers the EX cost plus keep_meter, it asks for the EX version with chance_pct. Absent = never. E22: \"The standard-tier AI doesn't use EX or burst yet.\" Applied only in elder and Tanuki fights (the node decides, not the profile).",
      "type": "object",
      "required": ["chance_pct"],
      "additionalProperties": false,
      "properties": {
        "chance_pct": { "type": "integer", "minimum": 0, "maximum": 100 },
        "keep_meter": { "type": "integer", "minimum": 0, "maximum": 300, "description": "Meter (100 = 1 bar) kept back after paying for the EX. Default 0." }
      }
    },
    "burst_use": {
      "description": "YOK-57 (C6, E13): on each hit the AI sees itself take, once it has taken min_combo_hits in a row and its health shows at most max_health_pct of the bar, it bursts with chance_pct (once per fight, from hitstun only: a thrown fighter breaks instead). Absent = never. E22: \"The standard-tier AI doesn't use EX or burst yet.\" Applied only in elder and Tanuki fights (the node decides, not the profile).",
      "type": "object",
      "required": ["chance_pct"],
      "additionalProperties": false,
      "properties": {
        "chance_pct": { "type": "integer", "minimum": 0, "maximum": 100 },
        "min_combo_hits": { "type": "integer", "minimum": 1, "maximum": 20, "description": "Hits in a row seen before it considers bursting. Default 1." },
        "max_health_pct": { "type": "integer", "minimum": 1, "maximum": 100, "description": "Only bursts at or below this share of its health bar. Default 100." }
      }
    },
    "elder_twist": {
      "type": "object",
      "required": ["id", "description"],
      "additionalProperties": false,
      "properties": {
        "id": { "$ref": "common.schema.json#/$defs/id" },
        "description": { "type": "string", "minLength": 1 }
      }
    },
    "rules": { "$ref": "common.schema.json#/$defs/ruleIds" },
    "notes": { "$ref": "common.schema.json#/$defs/notes" }
  },
  "$defs": {
    "observation": {
      "description": "Something visible on screen (P6).",
      "enum": [
        "neutral", "at_close_range", "at_mid_range", "at_full_screen",
        "opponent_jumping", "opponent_knocked_down", "self_knocked_down", "self_got_up",
        "projectile_on_screen", "blocked_projectile", "blocked_two_hits_in_row",
        "opponent_whiffed", "opponent_blocking", "opponent_in_recovery", "opponent_attacking",
        "opponent_used_same_special_twice"
      ]
    },
    "action": {
      "type": "string",
      "description": "A move id (normal or special), a generic action, or special:copied = the Tanuki's copied special, resolved when the copy locks (T0, T1; YOK-94). 'copied' is reserved and is no special's id.",
      "pattern": "^(walk_forward|walk_back|dash_forward|dash_back|jump|block|crouch_block|throw|special:copied|special:[a-z0-9-]+|normal:[a-z0-9-]+)$"
    }
  }
}
