{
  "kind": "profile",
  "id": "tanuki-boss",
  "status": "proposed",
  "yokai": "tanuki",
  "temperament": "boss",
  "reaction": {
    "tier": "tanuki",
    "frames": 15
  },
  "aggression_bias": 60,
  "preferred_range": "mid",
  "habit": {
    "id": "throws-at-a-turtle",
    "description": "When the player keeps blocking, the Tanuki grabs. Mix in a throw break or step out instead of holding guard.",
    "when": "opponent_blocking",
    "do": "throw",
    "chance_pct": 60
  },
  "tell_cover_pct": 0,
  "ex_use": {
    "chance_pct": 40,
    "keep_meter": 0
  },
  "burst_use": {
    "chance_pct": 50,
    "min_combo_hits": 2
  },
  "behaviours": [
    {
      "when": "at_mid_range",
      "do": "walk_forward",
      "weight": 40
    },
    {
      "when": "at_full_screen",
      "do": "dash_forward",
      "weight": 40
    },
    {
      "when": "at_mid_range",
      "do": "special:copied",
      "weight": 30
    },
    {
      "when": "at_full_screen",
      "do": "special:copied",
      "weight": 20
    },
    {
      "when": "at_close_range",
      "do": "normal:ryo-medium-punch",
      "weight": 30
    },
    {
      "when": "at_close_range",
      "do": "normal:ryo-light-kick",
      "weight": 25
    },
    {
      "when": "at_close_range",
      "do": "normal:ryo-heavy-punch",
      "weight": 15
    },
    {
      "when": "at_close_range",
      "do": "throw",
      "weight": 15
    },
    {
      "when": "opponent_jumping",
      "do": "normal:ryo-heavy-punch",
      "weight": 50
    },
    {
      "when": "opponent_whiffed",
      "do": "normal:ryo-heavy-kick",
      "weight": 50
    },
    {
      "when": "opponent_attacking",
      "do": "block",
      "weight": 30
    }
  ],
  "rules": [
    "Y1",
    "Y2",
    "Y4",
    "Y5",
    "P6",
    "E22",
    "P5",
    "T0",
    "T2",
    "T4",
    "C6",
    "E13",
    "E16"
  ],
  "notes": "Tanuki (T0): Ryo's normals, generic throw and starters, plus the one copied special (T2-T4) through special:copied, which resolves to the special locked at T1 (YOK-94); no special id is named here. Habit (throws at a blocking opponent, 60%) confirmed by the designer on 2026-10-11. Y5 raises aggression_bias at runtime. YOK-57 (proposed, needs Rules Lawyer and the designer): ex_use 40% when the copied special has an EX and a bar shows; burst_use 50% from the second hit of a combo."
}
