{
  "kind": "profile",
  "id": "kappa-aggressive",
  "status": "proposed",
  "yokai": "kappa",
  "temperament": "aggressive",
  "reaction": {
    "tier": "yokai",
    "frames": 22
  },
  "aggression_bias": 75,
  "preferred_range": "close",
  "habit": {
    "id": "throws-after-two-blocked-hits",
    "description": "After blocking two hits in a row the Kappa grabs. Stop at one hit, or jump or back off after the second block, and the throw whiffs.",
    "when": "blocked_two_hits_in_row",
    "do": "throw",
    "chance_pct": 70
  },
  "tell_cover_pct": 0,
  "behaviours": [
    {
      "when": "at_full_screen",
      "do": "walk_forward",
      "weight": 60
    },
    {
      "when": "at_mid_range",
      "do": "walk_forward",
      "weight": 70
    },
    {
      "when": "at_mid_range",
      "do": "dash_forward",
      "weight": 20
    },
    {
      "when": "at_close_range",
      "do": "throw",
      "weight": 45
    },
    {
      "when": "opponent_attacking",
      "do": "block",
      "weight": 30
    },
    {
      "when": "opponent_jumping",
      "do": "throw",
      "weight": 40
    }
  ],
  "rules": [
    "Y1",
    "Y2",
    "Y4",
    "Y5",
    "P6",
    "E22"
  ],
  "notes": "Anti-air (YOK-165): answers opponent_jumping with the generic throw (C4), the single attacking answer so jump_punish_pct sets the rate; it catches the jumper in landing frames (E19). Swap to a Kappa rising normal when one lands. Kappa aggressive (Y2): walks straight into throw range. Its throw is the generic throw (C4); data/moves has no kappa-* normals or clips yet, so it has no strikes of its own. Add pokes when they land."
}
