{
  "kind": "profile",
  "id": "test-kitsune-patient",
  "status": "proposed",
  "yokai": "kitsune",
  "temperament": "patient",
  "reaction": { "tier": "yokai", "frames": 22 },
  "aggression_bias": 25,
  "preferred_range": "full_screen",
  "habit": {
    "id": "jumps-after-knockdown",
    "description": "Often jumps after being knocked down.",
    "when": "self_got_up",
    "do": "jump",
    "chance_pct": 60
  },
  "behaviours": [
    { "when": "at_full_screen", "do": "special:test-foxfire", "weight": 40 },
    { "when": "opponent_jumping", "do": "normal:test-ryo-heavy-punch", "weight": 70 },
    { "when": "at_close_range", "do": "dash_back", "weight": 50 },
    { "when": "projectile_on_screen", "do": "block", "weight": 60 },
    { "when": "opponent_attacking", "do": "block", "weight": 70 },
    { "when": "neutral", "do": "walk_back", "weight": 20 }
  ],
  "rules": ["Y1", "Y2", "Y4", "P6"],
  "notes": "TEST FIXTURE for YOK-27 (not game content): the data/samples kitsune-patient shape on the fixture Kitsune kit (Ryo's fixture normals stand in; her fixture Foxfire in slot C). The real profile is habit-writer's (YOK-44) in data/profiles/."
}
